{
  "report_id": "a1b2c3d4-e5f6-7890-1234-567890abcdef",
  "report_timestamp": "2024-05-31T12:00:00Z",
  "reporter_id": "TestLLM-001",
  "overall_task_description": "Testing the mistake logging xtask.",
  "overall_user_prompt_summary": "User asked to test the 'mistake add' functionality.",
  "overall_llm_action_summary": "LLM attempted to create a sample mistake entry and add it to the log.",
  "overall_severity": "Minor",
  "issues": [
    {
      "issue_id": "i1i2i3i4-a5b6-7890-c1d2-e3f4g5h6i7j8",
      "mistake_type": ["InstructionNotFollowed", "Other"],
      "mistake_description": [
        "The LLM initially forgot to create the sample entry file.",
        "This was a minor oversight during a test procedure."
      ],
      "expected_behavior_points": [
        "A sample_mistake_entry.json should be created before trying to add it."
      ],
      "actual_behavior_points": [
        "The 'add' command would have failed if the sample file didn't exist."
      ],
      "severity_per_issue": "Minor",
      "context_snippets": [
        {
          "source_identifier": "xtask/src/main.rs",
          "snippet": "if let Some(new_entry_file_str) = args.next() { ... }",
          "line_range": "L100-L105"
        }
      ]
    }
  ],
  "remediations": [
    {
      "remediation_id": "r1r2r3r4-x5y6-7890-z1a2-b3c4d5e6f7g8",
      "applies_to_issue_ids": ["i1i2i3i4-a5b6-7890-c1d2-e3f4g5h6i7j8"],
      "root_cause_analysis_points": [
        "Procedural error during testing."
      ],
      "correction_strategy_points": [
        "Ensure all prerequisite files are created before running dependent commands."
      ],
      "learning_points": [
        "Double-check test setup steps."
      ]
    }
  ],
  "report_metadata": {
    "test_case_id": "TC-MISTAKE-XTASK-001",
    "environment": "local_dev"
  }
}
